company,job-title,url,programming-languages,job-description
GM-Cruise,"Senior Systems Engineer, Software",https://boards.greenhouse.io/cruise/jobs/2277518?gh_jid=2277518,"Python, C++, SQL","We’re Cruise, the self-driving ride-hailing service.
We are building the world’s most advanced self-driving vehicles to safely connect people to the places, things, and experiences they care about. We believe self-driving vehicles  will help save lives, reshape cities, give back time in transit, and restore freedom of movement for many.
At Cruise, our engineers have opportunities to grow and develop while learning from leaders at the cutting-edge of their fields. With a culture of internal mobility, there's opportunity to thrive in a variety of disciplines. This is a place for dreamers and doers to succeed.
If you are looking to solve one of today’s most complex engineering challenges, see the results of your work in hundreds of self-driving cars, and make a positive impact in the world starting in our cities, join us.
We're looking for a Senior Systems Engineer to develop data-driven insights on the performance of our autonomous car, and use these insights to steer requirements, development activities, and influence test and validation activities.
  In this position, you’ll have the chance to work at the intersection of hardware, software and AV technology and have a hand in nearly every component of a technically sophisticated autonomous system.
  If you're interested in using data to drive and influence future programs and decisions for Cruise autonomous vehicles, let's chat! 
What you’ll be doing:
Develop long-term and stable requirements, verification/validation, and/or software solutions to advanced problems.
Perform analysis of AV data to characterize vehicle systems performance and influence systems engineering requirements development.
Lead and communicate engineering analyses that provide teams with all the information needed to develop and continuously improve the systems function and performance.
Collaborate with Engineering Managers to ensure design, implementation, and programs are on track, and regularly drive consensus among diverse stakeholders on technical projects.
Develop methods to analyze and compare the impact of SW changes on relevant performance metrics, translating data and analysis into actionable recommendations.
Build and manage relationships with all relevant stakeholders.
Work with engineers and data scientists to define outcome metrics and success criteria.
What you must have:
BS, MS, or PhD in Mechanical Engineering, Electrical Engineering, Aerospace Engineering, Physics, Computer Science, or another related field
2+ years of industry experience in system engineer, mechanical engineering, data analysis, data science, statistical analysis, or other related disciplines
You have experience working with large datasets, SQL and Python or C++
You enjoy working with data visualization tools
Ability to understand complex technical systems
Ability to adapt and operate under ambiguity
Strong technical and nontechnical communication skills
Critical thinking skills - interpret what the data is telling us, and which analyses will reveal impactful conclusions
Bonus Points!
Ability to identify and act on opportunities to improve processes and increase efficiency
Experience with robotics, autonomous vehicles, vehicle development or ADAS development
Why Cruise?
Our benefits are here to support the whole you:
Competitive salary and benefits 
401(k) Cruise matching program 
Medical / dental / vision, AD+D and Life
Flexible vacation and company paid holidays
Healthy meals and snacks provided
Paid parental leave & family expansion stipend
Monthly wellness stipend
Commuter benefits
We’re Integrated
Through our partnerships with General Motors and Honda, we are the only self-driving company with fully integrated manufacturing at scale.
We’re Funded
GM, Honda, SoftBank, and T. Rowe Price have invested billions in Cruise. Their backing for our technology demonstrates their confidence in our progress, team, and vision and makes us one of the leading autonomous vehicle organizations in the industry. Our deep resources greatly accelerate our operating speed.
We’re Independent
We have our own governance, board of directors, equity, and investors. Our independence allows us to not just work on the bleeding-edge of technology, but also define it.
We're Vested
You won’t just own your work here, you’ll have the potential to own equity in Cruise, too. We are competing in a market that is projected to grow exponentially, which gives our company valuation room to grow. 
Cruise LLC is an equal opportunity employer.  All applicants for employment will be considered without regard to race, color, religion, sex, national origin, age, disability, sexual orientation, gender identity or expression, veteran status, genetics or any other legally protected basis.   Below, you have the opportunity to share your preferred gender pronouns, gender, ethnicity, and veteran status with Cruise to help us identify areas of improvement in our hiring and recruitment processes. Completion of these questions is entirely voluntary.  Any information you choose to provide will be kept confidential, and will not impact the hiring decision in any way.
We also consider for employment qualified applicants regardless of criminal histories, consistent with applicable laws.  And, if you believe that you will need any type of accommodation, please let us know.

Note to Recruitment Agencies: Cruise does not accept unsolicited agency resumes. Furthermore, Cruise does not pay placement fees for candidates submitted by any agency other than its approved partners."
GM-Cruise,"Software Engineering Manager, Vehicle Controls",https://boards.greenhouse.io/cruise/jobs/1881569?gh_jid=1881569,,"We’re Cruise, the self-driving ride-hailing service.
We are building the world’s most advanced self-driving vehicles to safely connect people to the places, things, and experiences they care about. We believe self-driving vehicles  will help save lives, reshape cities, give back time in transit, and restore freedom of movement for many.
At Cruise, our engineers have opportunities to grow and develop while learning from leaders at the cutting-edge of their fields. With a culture of internal mobility, there's opportunity to thrive in a variety of disciplines. This is a place for dreamers and doers to succeed.
If you are looking to solve one of today’s most complex engineering challenges, see the results of your work in hundreds of self-driving cars, and make a positive impact in the world starting in our cities, join us.
The Vehicle Controls team is responsible for the software and algorithms that makes the vehicle follow commanded reference trajectories in a safe, accurate, and reliable manner. This includes controller design and implementation (feedback and feedforward control) for reference tracking, state and parameter estimation, vehicle dynamics modeling, and fault detection/tolerance. Vehicle Controls lives between Motion Planning (responsible for generating comfortable, collision-free feasible trajectories) and Embedded Software (responsible for the hardware interface to the car’s actuators and sensors).
We are looking for a hands-on software engineering manager to lead, manage and grow an engineering team responsible for the Control Software that runs on our autonomous fleet. At Cruise, we believe in managers who remain deeply technical, and understand the challenges their teams are facing. The engineering manager will lead the technical direction of the team, mentor engineers and support career development, drive design decisions and code review, contribute hands-on to engineering development, and communicate team status and objectives with Senior management. 
What you'll be doing:
Lead the team’s efforts in extending the capability of Controls to cover more challenging driving scenarios and new vehicle platforms. 
Participate in design and code reviews.
Set up processes within the team to ensure high quality engineering architecture and design along with fast, reliable, testable production code
Work with Technical Project Managers and Senior Engineering Managers to develop and execute project roadmaps
Collaborate with recruiting to scale the team
Foster a collaborative culture of testing, safety, and documentation
Increase the productivity of the team by identifying process gaps, common pain points and scalability issues and develop a plan to address them
Work with GM and Cruise AV safety and validation teams on testing and requirements verification
Embody Cruise behaviors: Stay Safe, Own It, Stay Focused, Seek Truth, Work Together, Be Humble
What you must have:
Experience managing a software engineering team in a production environment
Prior experience as a software developer (C++)
Deep understanding of Linear and Nonlinear Control strategies and analysis tools
Practical knowledge of rigid body dynamics modeling and simulation
Bonus Points!
Knowledge of vehicle dynamics (suspension models, tire models, actuator and sensor models)
Familiarity with automotive or aerospace (or similar) safety critical systems and testing
Experience with autonomous vehicles or robot path planning
Familiarity with state and parameter estimation methods
Familiarity with Model Predictive Control (MPC)
Familiarity with automotive cruise control systems, ABS, traction control, stability control, etc. 
Experience with ROS
Experience in code optimization or high performance computing 
Why Cruise?
Our benefits are here to support the whole you:
Competitive salary and benefits 
401(k) Cruise matching program 
Medical / dental / vision, AD+D and Life
Flexible vacation and company paid holidays
Healthy meals and snacks provided
Paid parental leave & family expansion stipend
Monthly wellness stipend
Commuter benefits
We’re Integrated
Through our partnerships with General Motors and Honda, we are the only self-driving company with fully integrated manufacturing at scale.
We’re Funded
GM, Honda, SoftBank, and T. Rowe Price have invested billions in Cruise. Their backing for our technology demonstrates their confidence in our progress, team, and vision and makes us one of the leading autonomous vehicle organizations in the industry. Our deep resources greatly accelerate our operating speed.
We’re Independent
We have our own governance, board of directors, equity, and investors. Our independence allows us to not just work on the bleeding-edge of technology, but also define it.
We're Vested
You won’t just own your work here, you’ll have the potential to own equity in Cruise, too. We are competing in a market that is projected to grow exponentially, which gives our company valuation room to grow. 
Cruise LLC is an equal opportunity employer.  All applicants for employment will be considered without regard to race, color, religion, sex, national origin, age, disability, sexual orientation, gender identity or expression, veteran status, genetics or any other legally protected basis.   Below, you have the opportunity to share your preferred gender pronouns, gender, ethnicity, and veteran status with Cruise to help us identify areas of improvement in our hiring and recruitment processes. Completion of these questions is entirely voluntary.  Any information you choose to provide will be kept confidential, and will not impact the hiring decision in any way.
We also consider for employment qualified applicants regardless of criminal histories, consistent with applicable laws.  And, if you believe that you will need any type of accommodation, please let us know.
Note to Recruitment Agencies: Cruise does not accept unsolicited agency resumes. Furthermore, Cruise does not pay placement fees for candidates submitted by any agency other than its approved partners."
GM-Cruise,"Software Engineer, Perception Quality",https://boards.greenhouse.io/cruise/jobs/1974090?gh_jid=1974090,"Python, R, SQL","We’re Cruise, the self-driving ride-hailing service.
We are building the world’s most advanced self-driving vehicles to safely connect people to the places, things, and experiences they care about. We believe self-driving vehicles  will help save lives, reshape cities, give back time in transit, and restore freedom of movement for many.
At Cruise, our engineers have opportunities to grow and develop while learning from leaders at the cutting-edge of their fields. With a culture of internal mobility, there's opportunity to thrive in a variety of disciplines. This is a place for dreamers and doers to succeed.
If you are looking to solve one of today’s most complex engineering challenges, see the results of your work in hundreds of self-driving cars, and make a positive impact in the world starting in our cities, join us.
Cruise drives thousands of autonomous miles in the streets of San Francisco every week while our self driving stack is constantly evolving as we learn more about driving challenges. Given the rapid improvements in our stack, we realized that the challenge of testing an autonomous car is as challenging as building one. 
Our Software Engineers working on Perception Quality are in charge of developing cutting edge methods to evaluate Autonomous Vehicle behavior. They own and build statistical tools that allow us to predict the behavior of Cruise in the next Release using a variety of simulation frameworks and on-road data. We drive programs across cross-functional stakeholders in engineering, data science, machine learning platform, and design to develop market-leading autonomous software evaluation strategy and repeatable testing workflows across Cruise AI.
What you'll be doing:
Develop automated workflows using python to fill framework and tooling gaps
Design and create useful web APIs to allow users to perform tasks necessary for testing
Accurately and effectively communicate problems or solutions to other engineers
Develop SQL queries to analyze data to create reports and dashboards to drive engineering decisions
Collaborate and communicate with others to concretely define and break up problems
Always be reviewing processes for automation and tooling efficiency
What you must have:
Strong problem solving skills and data driven solutions
Experience automating test processes and writing test frameworks
Strong communication and organizational skills
Strong computer science fundamentals in object-oriented design, data structures, algorithm design, problem solving, and complexity analysis
2+ years of experience working as a data analyst (Experience with SQL, Python, R, VBA and/or similar programming language)
Experience interfacing with web APIs
Bonus Points!
Master's or PhD degree in engineering or science
3+ years of experience as a Software Engineer
Confident in solving ambiguous/undefined problems
Experience in testing robotics and high-performance, highly-available and scalable distributed systems
Strong background in Statistics 
Experience with open source tools and resources
Experience with CI/CD
Why Cruise?
Our benefits are here to support the whole you:
Competitive salary and benefits 
401(k) Cruise matching program 
Medical / dental / vision, AD+D and Life
Flexible vacation and company paid holidays
Healthy meals and snacks provided
Paid parental leave & family expansion stipend
Monthly wellness stipend
Commuter benefits
We’re Integrated
Through our partnerships with General Motors and Honda, we are the only self-driving company with fully integrated manufacturing at scale.
We’re Funded
GM, Honda, SoftBank, and T. Rowe Price have invested billions in Cruise. Their backing for our technology demonstrates their confidence in our progress, team, and vision and makes us one of the leading autonomous vehicle organizations in the industry. Our deep resources greatly accelerate our operating speed.
We’re Independent
We have our own governance, board of directors, equity, and investors. Our independence allows us to not just work on the bleeding-edge of technology, but also define it.
We're Vested
You won’t just own your work here, you’ll have the potential to own equity in Cruise, too. We are competing in a market that is projected to grow exponentially, which gives our company valuation room to grow. 
Cruise LLC is an equal opportunity employer.  All applicants for employment will be considered without regard to race, color, religion, sex, national origin, age, disability, sexual orientation, gender identity or expression, veteran status, genetics or any other legally protected basis.   Below, you have the opportunity to share your preferred gender pronouns, gender, ethnicity, and veteran status with Cruise to help us identify areas of improvement in our hiring and recruitment processes. Completion of these questions is entirely voluntary.  Any information you choose to provide will be kept confidential, and will not impact the hiring decision in any way.
We also consider for employment qualified applicants regardless of criminal histories, consistent with applicable laws.  And, if you believe that you will need any type of accommodation, please let us know.
Note to Recruitment Agencies: Cruise does not accept unsolicited agency resumes. Furthermore, Cruise does not pay placement fees for candidates submitted by any agency other than its approved partners."
GM-Cruise,"Staff Applied Research Scientist, Computer Vision",https://boards.greenhouse.io/cruise/jobs/2223891?gh_jid=2223891,"Python, C++","We’re Cruise, the self-driving ride-hailing service.
We are building the world’s most advanced self-driving vehicles to safely connect people to the places, things, and experiences they care about. We believe self-driving cars will help save lives, reshape cities, give back time in transit, and restore freedom of movement for many.
Cruisers have the opportunity to define new ways of working and learn from world-class leaders in their field. This is a place for dreamers and doers to succeed.
If you are looking to play a part in making a positive impact in the world by advancing the revolutionary work of self-driving cars, join us.
What you'll be doing:
As a Staff Applied Research Scientist - Computer Vision, you drive the research projects that address the everyday challenges that happen on urban roads, ones that do not have standard solutions available. On a day-to-day basis, you will:
Formulate problems
Propose, prototype, evaluate, and iterate solutions
Support productizing and deploying solutions to robot cars
Initiate and lead new projects
Considered one of the technical leaders of the department who guides current and future technology choices
Have a deep understanding of the business and operational impact for different technology tradeoffs, and able to balance effectively based on company’s need
Enable others engineers on the team to be more effective through design and code that is easy to extend and contribute into
Capable of influencing others and building consensus even over contentious technical debates
What you must have:
PhD / MS degree in computer vision, machine learning or a related field with multiple research publications in top conferences or journals; alternatively equivalent years of industry experience solving CV problems which do not have readily-available solutions
Expertise in at least one of these specific areas: 2D/3D object detection, semantic / instance segmentation, fine-grained attribute understanding, human pose / gesture recognition, image sequence / semantics understanding, image embedding, visual/LIDAR-based tracking, multi-object tracking, and vision-based behavior prediction
Track record of driving ML research projects from start to completion, including conception, problem definition, experimentation, iteration, and finally publication or productization
Strong programming skills in Python and/or C++
Strong verbal and written communication skills
Bonus Points!
PhD in machine learning, computer vision, or robotics vision
Experience using deep-learning frameworks, e.g., TensorFlow, PyTorch, etc
Experience in deploying perception algorithms and models into real-world environments
Why Cruise?
Our benefits are here to support the whole you:
Competitive salary and benefits 
401(k) Cruise matching program 
Medical / dental / vision, AD+D and Life
Flexible vacation and company paid holidays
Healthy meals and snacks provided
Paid parental leave & family expansion stipend
Monthly wellness stipend
Commuter benefits
We’re Integrated
Through our partnerships with General Motors and Honda, we are the only self-driving company with fully integrated manufacturing at scale.
We’re Funded
GM, Honda, SoftBank, and T. Rowe Price have invested billions in Cruise. Their backing for our technology demonstrates their confidence in our progress, team, and vision and makes us one of the leading autonomous vehicle organizations in the industry. Our deep resources greatly accelerate our operating speed.
We’re Independent
We have our own governance, board of directors, equity, and investors. Our independence allows us to not just work on the bleeding-edge of technology, but also define it.
We're Vested
You won’t just own your work here, you’ll have the potential to own equity in Cruise, too. We are competing in a market that is projected to grow exponentially, which gives our company valuation room to grow. 
Cruise LLC is an equal opportunity employer.  All applicants for employment will be considered without regard to race, color, religion, sex, national origin, age, disability, sexual orientation, gender identity or expression, veteran status, genetics or any other legally protected basis.   Below, you have the opportunity to share your preferred gender pronouns, gender, ethnicity, and veteran status with Cruise to help us identify areas of improvement in our hiring and recruitment processes. Completion of these questions is entirely voluntary.  Any information you choose to provide will be kept confidential, and will not impact the hiring decision in any way.
We also consider for employment qualified applicants regardless of criminal histories, consistent with applicable laws.  And, if you believe that you will need any type of accommodation, please let us know.
Note to Recruitment Agencies: Cruise does not accept unsolicited agency resumes. Furthermore, Cruise does not pay placement fees for candidates submitted by any agency other than its approved partners."
