company,job-title,url,programming-languages,job-description
Tesla,Software Developer - Test Systems,https://www.tesla.com/jp/careers/job/software-developer-testsystems-54331,"Python, SQL","The Role
Test Systems Engineering identifies, designs and builds end to end test solutions to accelerate research and product development cycles. The team leverage internal technologies to reduce cost and complexity while improving test functionality and flexibility. A critical fast paced and agile team working within the Engineering department across Vehicle, Energy and Charging platforms, TSE facilitates operational excellence in test execution and efficiency.
The TSE team is looking for a highly motivated software engineer responsible for all facets of test systems development. This candidate will have a solid understanding of EE fundamentals to understand the data acquisition and power electronics controls that are fundamental to many test systems. The candidate will be analytical and organized in their approach as well as a strong communicator to network across the engineering organization.

Responsibilities
Architect and develop high performing HIL/SIL applications in LabVIEW and Python which are well organized, structured, documented, and reusable.
Develop, maintain SQL/NoSQL database infrastructure supporting large scale time-series data and analysis.
Investigate root cause of failures to drive continual improvement.
Develop engineering tools, including desktop and web based testing applications.
Commission and troubleshoot new electromechanical test systems.
Build HIL/SIL test systems from ground up using open-source hardware and software platform.
Introduce bleeding edge technology to the team.

Requirements
Minimum BS degree in Software, Electrical, or Mechatronics Engineering or equivalent and +3 years of experience in software product development.
Expert in electromechanical test and test automation.
Experience developing real-time/non real-time test applications in LabVIEW.
Knowledge of SQL and NoSQL database, i.e., Hadoop, mongoDB, MySQL etc.
Experience in HIL/SIL software architecture.
Experience in writing device drivers for 3rd party hardware in Windows and Linux.
Experience with Python and Git or other source control platforms.
Strong understanding of high voltage and electrical principles.
Familiarity with a range of electrical bench test instruments.
Strong interpersonal and communications skills.

Desired
Experience with automotive communication protocols and tools, including CAN, LIN, PCAN, CANape, NI-XNET, Ethernet etc.
RESTful web services and web applications.
Expert in database schema and web system design.
Experience with testing of high-power equipment, i.e. motors, power electronics.
Experience in test automation frameworks.
Experience in CI tools (Jenkins etc.)
Experience with PCB layout and schematic design.
Passion for EV’s and sustainable energy."
Tesla,"Backend Software Engineer, Design Technology",https://www.tesla.com/jp/careers/job/backend-softwareengineerdesigntechnology-54394,"Python, C, C++, Java","The Role
We are seeking an experienced software engineer to lead the Design Technology team at Tesla. This team is responsible for developing systems which will facilitate and accelerate the pace of design and manufacturing at Tesla across our whole portfolio of products (Passenger vehicles, Commercial vehicles, Energy & Solar).
Tesla’s mission to accelerate the transition to sustainable energy requires us to be extremely efficient and automated and Design Technology is laying the foundations we need to build the machine that build the machine.
The successful candidate will have strong technical skill, an ability to navigate trade-offs, and a dedication to delivering quality code.
Responsibilities
Develop state of the art code
Contribute to the software development culture of the group
Develop and maintain relationships across groups with all the stakeholders in the system
Design, extend and review software architecture
Be hands on and involved with every stage of the product development cycle
Contribute to standards and best practice for software engineering
Share and seek expertise across groups at Tesla
Requirements
3+ years software engineer experience with evidence of excellence
Strong development skills in languages such as go, java, c/c++, python (existing codebase is mostly written in go with some java components)
Comfortable navigating trade-offs to bring the right data structures and algorithms to the problem, with a solid grasp of distributed algorithms (e.g. distributed consensus).
Meticulous around visibility of the systems you build; openmetrics (prometheus/grafana), centralised structured logging, tracing.
Dedicated to unit and integration testing and coverage.
Solid systems understanding (specifically Linux, and particularly around performance analysis)
Comfortable using the tools of the trade; debuggers, source control, profiling, unit test coverage.
Familiarity with developing APIs with the care they deserve (e.g. gRPC/REST with OpenAPI/Swagger)
Familiarity with cloud native deployment practices; specifically, containers and container orchestration platforms (Docker/Kubernetes/Helm) and the kubernetes environment (networking, nginx ingress, apache, haproxy, etc) and familiarity with cloud native development best practices (12 factor applications)
Familiarity with publish/subscribe event buses such as Apache Kafka or NATS, as well as distributed data stores (relational and otherwise) and an understanding of underlying technologies (e.g. log-structure merge trees, raft etc)
Knowledge with object stores (S3, geographically distributed storage)
Familiar with authentication and authorisation techniques (e.g. OpenID Connect)"
Tesla,Software Engineer - Factory Software,https://www.tesla.com/jp/careers/job/software-engineer-factorysoftware-54696,"Python, Java, Ruby, Go","Role
The Factory Software team is seeking a Site Reliability engineer to join the Factory Software team.  The Factory Software team writes, runs software and services to orchestrate the flow of manufacturing and materials through Tesla factories. We apply agile development on a modern, distributed system architecture to provide the operational foundation for high-volume vertically integrated 24x7 manufacturing of complex, safety-critical products. Our solutions integrate tightly with both business applications and manufacturing and material automation to coordinate work by factory and warehouse operators and supervisors. We also enable continuous product and process improvement with actionable analysis and visualization of product quality, genealogy, and manufacturing flow.
Responsibilities
•      Understand full stack of factory software systems
•      Monitor performance and provide recommendations for areas of improvement
•      Authoring technical documentation for workflows/processes/best practices.
•      Manage our on and off-prem kubernetes clusters to support our growing workloads
•      Take part in a 24x7 on-call rotation.
•      Influence architectural decisions with focus on security, scalability and high-performance.
•      Setup and maintain monitoring, metrics & reporting systems for fine-grained observability and actionable alerting.
Requirements
•      4+ years of managing services in a distributed, internet-scale *nix environment.
•      BS or MS degree in Computer Science or Engineering, or equivalent experience.  
•      Ability to prioritize tasks and work independently
•      Advanced or expert-level Linux administration.
•      Track record of practical problem solving under pressure.
•      Excellent communication, and documentation skills.
•      Advanced experience with configuration management systems such as Ansible, Puppet or Terraform.
•      Experience with AWS, or other cloud infrastructure providers.
•      Experience managing container-based workloads, using Kubernetes or other orchestration software
•      Proficiency in a high-level language like Python, Go, Ruby and/or Java
•      Excellent communication skills to collaborate with teams globally
•      Ability to manage competing priorities, and work well under pressure
•      Self-driven with an analytical mind with a bias for action
•      Knowledge of big data platforms such as Hadoop a plus"
Tesla,"Site Reliability Engineer, Factory Software",https://www.tesla.com/jp/careers/job/site-reliabilityengineerfactorysoftware-54697,"Python, Java, Ruby, Go","Role
The Factory Software team is seeking a Site Reliability engineer to join the Factory Software team.  The Factory Software team writes, runs software and services to orchestrate the flow of manufacturing and materials through Tesla factories. We apply agile development on a modern, distributed system architecture to provide the operational foundation for high-volume vertically integrated 24x7 manufacturing of complex, safety-critical products. Our solutions integrate tightly with both business applications and manufacturing and material automation to coordinate work by factory and warehouse operators and supervisors. We also enable continuous product and process improvement with actionable analysis and visualization of product quality, genealogy, and manufacturing flow.
Responsibilities
•      Understand full stack of factory software systems
•      Monitor performance and provide recommendations for areas of improvement
•      Authoring technical documentation for workflows/processes/best practices.
•      Manage our on and off-prem kubernetes clusters to support our growing workloads
•      Take part in a 24x7 on-call rotation.
•      Influence architectural decisions with focus on security, scalability and high-performance.
•      Setup and maintain monitoring, metrics & reporting systems for fine-grained observability and actionable alerting.
Requirements
•      4+ years of managing services in a distributed, internet-scale *nix environment.
•      BS or MS degree in Computer Science or Engineering, or equivalent experience.  
•      Ability to prioritize tasks and work independently
•      Advanced or expert-level Linux administration.
•      Track record of practical problem solving under pressure.
•      Excellent communication, and documentation skills.
•      Advanced experience with configuration management systems such as Ansible, Puppet or Terraform.
•      Experience with AWS, or other cloud infrastructure providers.
•      Experience managing container-based workloads, using Kubernetes or other orchestration software
•      Proficiency in a high-level language like Python, Go, Ruby and/or Java
•      Excellent communication skills to collaborate with teams globally
•      Ability to manage competing priorities, and work well under pressure
•      Self-driven with an analytical mind with a bias for action
•      Knowledge of big data platforms such as Hadoop a plus"
Tesla,Staff Software Engineer (Golang),https://www.tesla.com/jp/careers/job/staff-softwareengineergolang-55194,"Java, Ruby, JavaScript, Go","Role
Tesla is looking for a strong Software Engineer to design and develop software for its current and next generations of Business Systems Applications. This position will be working with the Software Engineering team in Fremont, CA.   
The team will build the system used to supply material to the distribution and service centers. It will be built with the long-term vision of being a global system to manage warehouses for all Tesla business operations, which includes Vehicle Service and Energy Products. This will be a business-critical system essential to support the growth and mission of Tesla.  The candidate will be working in Go, Angular, React, and MySQL.
 Responsibilities
Design, implement and deliver end-to-end fully functional solutions.
Contribute relevant, clean, concise quality documentation to Tesla’s knowledge base to support increase organizational information sharing.
Automating your repetitive development tasks.
Evangelize best practices in Software development and Software development lifecycle.
Requirements
B.S. degree in Computer Science, IT or related fields
4+ years in Application Development
RESTful API Design & Implementation
Experience with Automated Testing
Web Frontend Development, using tools such as JavaScript, Angular, React, etc.
Backend Development, using tools such as Go, Java, Ruby, etc.
Database knowledge such as MySQL, Oracle, Postgres etc. 
Experience working on business services software or enterprise software
 "
Tesla,PLM Solution Architect – Software,https://www.tesla.com/jp/careers/job/plm-solutionarchitectsoftware-55256,"Python, C","The Role

As a PLM Solution Architect, you will help shape the next generation of engineering software and fulfill Design Technology’s mission to accelerate the pace of product development across our whole portfolio of vehicle, energy and solar products.
To fulfill its goal, the Design Technology team is injecting some core software engineering principles in the mechanical engineering world. We are:
Making the design work more efficient by developing state of the art tools.
Driving better decision making by ensuring that design data is broadly available.
Accelerating design iterations by shrinking the feedback loop.
Your role as a PLM Solution Architect will be to lead the design and implementation of our technical vision. You will interface with business stakeholders, developers, and program managers to determine the best solutions to Tesla’s need.
The ideal candidate has a proven experience with Product Lifecycle Management system, a deep understanding how complex product are design, manufactured and serviced and experience with solution development in those contexts.
Responsibilities
Provide technical and architectural direction for the PLM system and technical staff.
Develop detailed technical specifications for solutions to business challenges.
Prepare and present trade-off analyses for technical decisions.
Interface with IT professionals to stand up server and network solutions for the PLM system.
Interface with business analysts and stakeholders to understand the needs of the business.
Coordinate with Project Management to highlight risks and technical constraints.
Stay abreast of current and emerging technologies and trends relevant to the PLM space.
Requirements
Bachelor’s degree in Information Technology, Software Engineering, Computer Science, or related field.
5+ years of experience in engineering and software architecture design.
Experience of designing/ handling data between different applications.
Efficient communication skills.
Strong organizational and leadership skills.
Advanced understanding of business analysis techniques and processes.
Plus
In-depth understanding of coding languages (Java, Python, C, etc.) and design patterns.
Project management and leadership skills.
Experience with the 3DExperience Platform and its product.


* * * * * * * *

Employee Benefits 
As a full time Tesla employee you will receive full benefits from day 1 for you and your dependents. 
Kaiser and UnitedHealthcare PPO and HSA plans (including infertility coverage)
3 medical plan choices with $0 paycheck contribution 
Vision & dental plans (including orthodontic coverage)
Company paid Life, AD&D, short-term and long-term disability 
401(k), Employee Stock Purchase Plans, and other financial benefits 
Employee Assistance Program, Paid Time Off, and Paid Holidays
Back-up childcare and employee discounts"
Tesla,"Software Engineer, Factory Software (Golang)",https://www.tesla.com/jp/careers/job/software-engineerfactorysoftwaregolang-55259,JavaScript,"The Role

We are looking for a highly motivated software engineer specializing in server-side software and backend development. You will join a small, expert team building server-side software for the systems that manufacture our cars, superchargers, and energy storage. The ideal candidate will have a passion for building world-class software and a track record of success creating highly and scalable software systems. You will need strong software engineering skills, excellent interpersonal communication, and experience accepting and giving meaningful feedback on technical designs and pull requests.


Responsibilities
Lead the requirements gathering, technical specification, and the design and development of complex MOS projects
Lead and contribute to software architecture design, development of software applications, and integration into enterprise systems
Lead enterprise-scale MOS software introduction and subsequent roll-out to future production lines
Prepare and implement the long-term MOS support strategy
Develop and validate software test plans
Work closely with Operations, Manufacturing Engineering, Quality, and Supply Chain teams
Interact with teams of engineers from multiple disciplines

Requirements
Bachelor’s degree or higher in CS, CE, EE or the equivalent in experience and evidence of exceptional ability.
Minimum 1 year of working experience. 
Experience in restful services.
Experience with distributed version control (GIT) .
Web fundamentals like HTML, JavaScript, CSS & angular JS
Expertise in modern web technologies and frameworks, preferably Go.
Excellent interpersonal communication skills."
Tesla,"Sr. Embedded Software Engineer - Software Platforms, Audio Systems",https://www.tesla.com/jp/careers/job/sr-embeddedsoftwareengineer-softwareplatformsaudiosystems-55877,"C, C++","The Role 
Tesla's System Software team provides the foundation on which the in-vehicle user experience is built. We build the software platform (kernel, bootchain, drivers, and lower level userspace platform services) for our innovative Infotainment hardware. This includes high resolution touch displays, high definition audio, bluetooth/wifi/cellular connectivity, USB, cameras, all connected to high performance multi-core processors and GPUs. Our software is based on Linux, GNU toolchain, buildroot, and other open source projects, delivering the security, capability, and performance demanded by our user experience. As part of this team, you would be focused on the audio software subsystem and framework for existing and next generation infotainment products.
Responsibilities 
Develop drivers, middleware and interfaces to user-space applications for the audio subsystem
 Drive architecture and execution for audio software systems and hardware with the hardware and DSP engineers.
 Use existing available hardware in innovative ways to solve problems
Integrate software components into a fully functional software system
Write well structured, testable, efficient, and maintainable code
Build and deploy software tools, processes and metrics
Board bringup and hardware design validation 
Requirements 
4+ years software/firmware development experience
2+ years experience w/Embedded Linux
Excellent C/C++ coding skills
Strong Linux kernel fundamentals
Experience with audio systems (ALSA, audio framework, audioflinger, audio drivers)
Experience with board /chip bringup
Excellent problem solving, critical thinking, and communication skills
Upstream contributions to Linux Kernel is a plus 
Contributions to involvement with open source projects is a plus
Experience with RTOS or bare-metal embedded development is a plus"
Tesla,Mobile Software Engineer - React Native,https://www.tesla.com/jp/careers/job/mobile-softwareengineer-reactnative-56014,,"The Digital Experience team at Tesla is at the forefront of building a consistent, global customer experience across all digital touchpoints – web, native apps and in-car infotainment systems. This team is building the next generation products and supporting infrastructure which allows our customers, living in 60+ countries, to understand, interact and purchase our amazing vehicles and energy products.

Tesla is seeking a Front-End Mobile Software Engineer to join our team and help build the next generation of web solutions for our service partners and customers as it relates to the ownership experience.  You will be challenged to turn apps around quickly but thoughtfully, balancing speed to market with longevity and scalability, all in the name of extraordinary customer experiences.

Responsibilities
Design, code and maintain mobile user experiences end-to-end.
Optimize code for performance, stability and maintainability.
Work with a cross-functional team of hardware engineers, application/UI software engineers, QA/Validation, and designers

Requirements
Bachelor’s Degree in Computer Science, Software Engineering, or similar areas of study. Minimum 2 years’ experience in Mobile (iOS/Android) development.
 1+ years building web and/or mobile experiences with evidence of exceptional ability
Proficient with React Native and Redux.
Proficient with TypesScript is a plus.
Familiar in Objective-C or Java.
Excellent grasp of fundamental computer science concepts, good at solving complex technical problem.
Experience using common design patterns. High standards for code quality, maintainability, and performance.
Experience creating, maintaining and shipping top-ranking mobile apps is preferred."
Tesla,"Embedded Software Engineer, Battery Management Systems (BMS)",https://www.tesla.com/jp/careers/job/embedded-softwareengineerbatterymanagementsystemsbms-56265,"C, C++","The Role
As an Embedded Software Engineer on the Battery Management System (BMS) Team, you will have the opportunity to accelerate the delivery of quality Tesla products to consumer markets.  You will be responsible for architecting, designing, and implementing firmware validation procedures, equipment, and automation regarding high voltage systems.  Your effort to create and spin up various automated validation infrastructures will have a direct impact on the reliability and robustness of the Tesla products as well as the customer experience.  The Tesla battery team is extremely focused on the quality of users’ indicators (i.e. range, SOC, power, etc.) which directly plays into the overall experience and the safety of the system as a whole.  The team strives to create robust, efficient firmware and your responsibility is to ensure the code quality extremely high.  You will work within the development and integration teams to create innovative automated test systems and implement tests are on these platforms.  These systems explore and validate the performance capabilities of our hardware and firmware. You will also play an important role in our future technologies roadmap, including firmware support for new products, packs, cells, etc.
Responsibilities
Work with various cross-functional teams to develop requirements for new BMS features, diagnostics, algorithms, etc
Design, implement and test cutting-edge algorithms for run-time BMS logic to derive State-of-Charge, State-of-Health, State-of-Power and State-of-Energy computations.
Develop Software-in-the-Loop infrastructure in a object-oriented fashion, making high degree of re-use of existing objects and objects that are highly reusable
Develop and enhance existing battery models to ensure Real vs. Simulation accuracy
Design rapid test iteration framework for developers to use for quick, at-desk spot checks
Develop “real world” playback mechanism for field data, integrating with existing Tesla data systems
Develop behavior models for various sub components of the vehicle, complete with fault insertion capability engineered in
Develop complex battery aging model(s) which accurately reflect true cell aging patterns
Requirements
BS in Electrical Engineering, Computer Science, Computer Engineering or proof of exceptional skills in related fields with practical software engineering experience
Minimum of 2 years of relevant experience (firmware engineer, embedded design and/or validation)
Expertise testing devices and debugging hardware (oscilloscope, logic analyzer, DMM)
Desire to participate in improving code robustness and designing testing infrastructure
Ability to think creatively and produce “outside of the box” solutions
Proficiency in C and C++
Scripting skills in at least one common language (Python, Perl, Shell)
Preferred: CANalyzer / CANape experience
Preferred: Experience in schematic design & capture (Altium Designer)
Preferred: Experience with FPGA or HDL (Verilog, VHDL)
Preferred: Background with Simulink and modeling embedded designs"
